### ISSUE TITLE
Connection not kept open?

### ISSUE THREAD

**Issue by ikbuben** [cloudamqp/amqproxy#50]
I'm experimenting with amqproxy a bit (using a kubernetes cluster). I have:

- a pod running a rabbitmq `3.8.13` with no tuning, just a `test` user and `test` vhost
- a pod with two co-located containers:
    - one with nodejs
    - one with amqproxy `0.5.3` from official docker image started with `--debug amqp://rabbit:5672`

Then on the nodejs container I run this very simple script:

```js
require('amqplib')
  .connect('amqp://test:test@localhost:5673/test')  // that's the amqproxy url
  .catch(console.error);
```

And I can see on the rabbitmq logs that the connection was successful (so far so good). After a few seconds I stop the previous script, but as soon as I do this the connection is closed on rabbitmq side.

**I expected the amqproxy to keep the connection open at least for a few seconds, but it is immediately closed**. Was my assumption wrong ? It looks like #46 but if my assumption is correct I'm willing to get to the bottom of this so I started a fresh one. I will provide a tcpdump soon if that helps.

![Screenshot 2021-03-31 at 13 32 09](https://user-images.githubusercontent.com/81688238/113139750-d16ea000-9227-11eb-9030-282ae70977d3.png)

Relevant logs:

```
2021-03-31 11:30:17.366 [info] <0.17676.9> accepting AMQP connection <0.17676.9> (10.233.98.89:48262 -> 10.233.125.85:5672)
2021-03-31 11:30:17.373 [info] <0.17676.9> connection <0.17676.9> (10.233.98.89:48262 -> 10.233.125.85:5672): user 'test' authenticated and granted access to vhost 'test'
2021-03-31 11:30:34.875 [info] <0.17676.9> closing AMQP connection <0.17676.9> (10.233.98.89:48262 -> 10.233.125.85:5672, vhost: 'test', user: 'test')
2021-03-31 11:30:34.876 [info] <0.17691.9> Closing all channels from connection '10.233.98.89:48262 -> 10.233.125.85:5672' because it has been closed
```

```
2021-03-31 11:29:34 UTC: Proxy upstream: rabbit:5672 
2021-03-31 11:29:34 UTC: Proxy listening on 0.0.0.0:5673
2021-03-31 11:30:17 UTC: Client connected: 127.0.0.1:35470
2021-03-31 11:30:34 UTC: Client disconnected: 127.0.0.1:35470: #<AMQProxy::Client::Error:Client disconnected>
2021-03-31 11:30:34 UTC: Client disconnected: 127.0.0.1:35470
```

**Comment by ikbuben** [comment]
Here is what the tcpdump looks like:

```
  1	0.000000	96:c2:35:e5:28:68	Broadcast	ARP	42	Who has 169.254.1.1? Tell 10.233.100.210
  2	0.000023	ee:ee:ee:ee:ee:ee	96:c2:35:e5:28:68	ARP	42	169.254.1.1 is at ee:ee:ee:ee:ee:ee
  
  ... DNS hidden
  
  7	0.001454	10.233.100.210	10.233.22.108	TCP	74	49854 → 5672 [SYN] Seq=0 Win=29200 Len=0 MSS=1460 SACK_PERM=1 TSval=3937678846 TSecr=0 WS=128
  8	0.001979	10.233.22.108	10.233.100.210	TCP	74	5672 → 49854 [SYN, ACK] Seq=0 Ack=1 Win=65160 Len=0 MSS=1460 SACK_PERM=1 TSval=607782637 TSecr=3937678846 WS=128
  9	0.002006	10.233.100.210	10.233.22.108	TCP	66	49854 → 5672 [ACK] Seq=1 Ack=1 Win=29312 Len=0 TSval=3937678846 TSecr=607782637
  10	0.002632	10.233.100.210	10.233.22.108	AMQP	74	Protocol-Header 0-9-1
  11	0.003062	10.233.22.108	10.233.100.210	TCP	66	5672 → 49854 [ACK] Seq=1 Ack=9 Win=65152 Len=0 TSval=607782638 TSecr=3937678847
  12	0.006996	10.233.22.108	10.233.100.210	AMQP	591	Connection.Start
  13	0.007006	10.233.100.210	10.233.22.108	TCP	66	49854 → 5672 [ACK] Seq=9 Ack=526 Win=30336 Len=0 TSval=3937678851 TSecr=607782642
  14	0.007145	10.233.100.210	10.233.22.108	AMQP	325	Connection.Start-Ok
  15	0.007995	10.233.22.108	10.233.100.210	AMQP	86	Connection.Tune
  16	0.008039	10.233.100.210	10.233.22.108	AMQP	86	Connection.Tune-Ok
  17	0.008101	10.233.100.210	10.233.22.108	AMQP	85	Connection.Open vhost=test
  18	0.008559	10.233.22.108	10.233.100.210	TCP	66	5672 → 49854 [ACK] Seq=546 Ack=307 Win=64896 Len=0 TSval=607782644 TSecr=3937678852
  19	0.009466	10.233.22.108	10.233.100.210	AMQP	79	Connection.Open-Ok
  20	0.051630	10.233.100.210	10.233.22.108	TCP	66	49854 → 5672 [ACK] Seq=307 Ack=559 Win=30336 Len=0 TSval=3937678896 TSecr=607782645
  21	14.055757	10.233.100.210	10.233.22.108	AMQP	127	Connection.Close reply=Pooled connection closed due to inactivity
  22	14.056460	10.233.22.108	10.233.100.210	AMQP	78	Connection.Close-Ok
  23	14.056472	10.233.100.210	10.233.22.108	TCP	66	49854 → 5672 [ACK] Seq=368 Ack=571 Win=30336 Len=0 TSval=3937692900 TSecr=607796691
  24	14.056580	10.233.100.210	10.233.22.108	TCP	66	49854 → 5672 [FIN, ACK] Seq=368 Ack=571 Win=30336 Len=0 TSval=3937692900 TSecr=607796691
  25	14.057268	10.233.22.108	10.233.100.210	TCP	66	5672 → 49854 [RST, ACK] Seq=571 Ack=369 Win=64896 Len=0 TSval=607796692 TSecr=3937692900
```

I see a big `Pooled connection closed due to inactivity`. What may cause this?

**Comment by carlhoerberg** [comment]
The pool is shrank every 5s: 
https://github.com/cloudamqp/amqproxy/blob/0cb9ef69d947c0c78cf84a9dd3c53f8f46033490/src/amqproxy/server.cr#L89
https://github.com/cloudamqp/amqproxy/blob/3e037a426234c37ae04eba76a04a6ae37c4efbe9/src/amqproxy/pool.cr#L35

Maybe the timer should be configurable..

**Comment by carlhoerberg** [comment]
With this patch amqproxy is waiting at least 5 seconds before an inactive connection is disconnected:
https://github.com/cloudamqp/amqproxy/commit/5f1b845e1ca4c743b6093dc8a99ea3cdc7235af5

**Comment by ikbuben** [comment]
Ok so with this patch and a little loop, I can see in the rabbit logs that indeed connections last for at least 5 seconds and they are correctly reused.

I guess a configurable shrink timer would be great, but this is enough for my use case. Thanks!
